spoonacular_recipe_id,title,instructions,servings,ready_in_minutes,image_url,created_at,updated_at
13073,Seared Ahi Tuna Salad,,4,52,https://xeucxcfsrxiytajlaskq.supabase.co/storage/v1/object/public/recipe-images/13073.jpg,2026-03-14 22:24:03.121729+00,2026-03-14 22:24:03.222+00
13265,Collard Greens With Bacon,,6,264,https://xeucxcfsrxiytajlaskq.supabase.co/storage/v1/object/public/recipe-images/13265.jpg,2026-03-14 23:16:30.498787+00,2026-03-14 23:16:30.635+00
53626,"Elegant, Intimate Thanksgiving","I did a terrible job of getting this posted during Thanksgiving. We had a small holiday dinner with friends before we all had to spend our actual holiday with extended family and the big, potluck fun for that day. For the four adults and three kids here, we could cook a special menu, a bit less traditional and upscale. If you have a small gathering, this is a great alternative Thanksgiving menu to try.

For the salad course, I recommend the Fall Kale Salad, and for dessert, the ultra-easy (make ahead) and stunning Pumpkin Panna Cotta with Bourbon Pecan Toffee.

Crispy Braised Duck with Cranberry-Port Sauce

Crispy Braised Duck

2 Ducks

1 onion, peeled and quartered

1 clementine, halved, peel on

2 ribs celery, roughly chopped

salt and pepper

Ľ cup mulling spices

1 gallon apple juice

Cranberry-Port Sauce

1-1/2 cups of the cooled, skimmed cooking liquid

2 cups port wine

1 cup balsamic vinegar

1/3 cup cranberry jelly

Prepare the Ducks:

Preheat the oven to 350 degrees.

Starting from the large cavity end, gently work your fingers between the skin and meat to loosen skin from the ducks, especially the breast as much as possible. Try not to tear the skin. Prick the skin all over with a fork to allow the fat to drain when cooking.

Stuff the duck cavities with the orange, celery and onion. Salt and pepper them lightly.

On the stove, bring the apple juice and mulling spices to a boil. Pour the boiling liquid over the ducks to tighten the skin. The liquid need to come up at least halfway to two-thirds up the sides of the ducks. You can add chicken stock if you need more liquid. Cover the pan tightly with foil.

Braise ducks:

Put oven rack in middle position and preheat oven to 350°F.  Braise for one hour, remove from oven and turn ducks over, cover again and braise for another hour.

Chill ducks:

Remove from oven. Transfer ducks to a large platter, draining any juices inside ducks back into pan. Pour the cooking liquid from the pan through a strainer into a large bowl. Place the ducks back in the roasting pan and chill both the large bowl of cooking liquid and the ducks, uncovered, at least 4 hours. You want to firm up the duck before the roasting step, and also solidify the fat on the cooking liquid.

Make Sauce:

Remove the bowl of cooking liquid from the refrigerator and skim off the fat. Measure 1 and a half cups of the liquid and add to a large sauce pan on the stove. Add two cups port, 1 cup balsamic vinegar, and 1/3 cup cranberry jelly, and 1 Tbs. Dijon mustard. Whisk and bring to a simmer, uncovered. Reduce over low heat until you get a syrup that coats the spoon, about a half an hour.

Roast ducks:

Put oven rack in middle position and preheat oven to 500°F.

Remove the roasting pan with ducks from the refrigerator and place in oven. Roast ducks until skin is crisp, about 20-25 minutes.

When done, transfer ducks to a platter and let stand at least 10 minutes before serving. Glaze lightly with some of the sauce, serve with remaining sauce.

Pumpkin Risotto

2 tablespoons extra-virgin olive oil

1 cup diced pumpkin, Ľ-inch dice

4 cups chicken broth

2 shallots, minced

1-1/4 cups Arborio rice

1/2 cup white wine

2/3 cup grated Gruyere cheese

2 tablespoons chopped fresh sage

Salt and freshly ground black pepper

On stove, or in a steamer, steam the pumpkin until fork tender, about 15 minutes. Set aside, keeping warm.

Heat the chicken broth in a small saucepan, and keep it warm over low heat.

In a large pot, heat 2 tablespoons olive oil over medium-low heat and sweat the shallot until translucent, about 5 minutes. Increase the heat to medium-high. Add the rice, and stir until it is evenly coated with oil, and the grains just begin to turn golden, about 3 minutes.

Add the wine and cook, stirring often, until the rice absorbs the liquid, about 5 minutes. Stir 2 cups of the warm chicken broth into the pot. Now you’re free from stirring for about 8 minutes, until the rice absorbs the liquid. After this step, you need to start stirring frequently.

Add another cup of the warm chicken broth to the pot and cook, stirring frequently, until all the liquid is absorbed, about five minutes. Add just 1/4 cup of broth next, and cook, stirring constantly, until all the liquid is absorbed, a few more minutes. Taste the rice; if it has reached al dente texture, you’re done. If not, add another 1/4 cup of broth and cook, stirring constantly, until all the liquid is absorbed. Repeat until the rice is done; you may not need all of the broth.

Mix in the Gruyere, gently fold in the cooked pumpkin, and sage. Season with salt and pepper to taste. Serve alongside the Crispy Duck, drizzle with the Cranberry-Port sauce.

Serves 4-6.",26,45,https://xeucxcfsrxiytajlaskq.supabase.co/storage/v1/object/public/recipe-images/53626.png,2026-03-14 23:05:55.3395+00,2026-03-14 23:05:55.483+00
157375,Steamy Creamy Mushroom Risotto,"<ol><li>Fry the chicken and the mushrooms and set aside.</li><li>Fry the rice in a pan in the oil for a minute. Start boiling water and prepare the chicken broth in a separate saucepan.</li><li>Start adding chicken broth water and the wine little by little to the rice and simmer at medium heat until the rice is cooked.</li><li>Once the rice is done, add the butter, the chicken, and the mushrooms and blend them in. Add the parmesan, salt, and pepper and stir one last time before you serve.</li></ol>",2,35,https://xeucxcfsrxiytajlaskq.supabase.co/storage/v1/object/public/recipe-images/157375.jpg,2026-03-14 22:22:43.272917+00,2026-03-14 22:22:43.374+00
157426,Stuffed Shells with Beef and Broc,"<p>1. Steam your frozen broccoli and cut it into smaller pieces if necessary.</p><p>2. Fry the onion in a hot skillet until translucent. While the onion is frying, go ahead and start boiling your pasta shells. I cooked mine half the recommended time, but they have to at least be soft enough to stuff!</p><p>3. Add the beef to the skillet with the onions. Drain your pasta when it's ready.</p><p>4. Once the beef is browned and crispy (to your liking), add the tomato sauce, salt, pepper, and herbs to the skillet. Turn the heat to low.</p><p>5. Mix the cream cheese with any fresh or dried herbs you like.</p><p>6. Pour your steamed, chopped broccoli into a casserole dish.</p><p>7. Stuff the shells with the cream cheese/herb mixture. Place the stuffed shells on top of the broccoli in the casserole dish. If you run out of cream cheese while stuffing, fill any remaining shells with some of the beef/tomato mixture.</p><p>8. Once all the shells are stuffed and in the casserole dish, pour the meat and tomato mixture over the shells evenly. Cover with the shredded cheddar cheese.</p><p>9. Bake at 176 C/350 F for 15 minutes or until the cheese has melted and the shells are soft (but not too soft ;))</p>",2,60,https://img.spoonacular.com/recipes/157426-556x370.jpg,2026-03-14 22:22:53.467309+00,2026-03-14 22:22:53.564+00
157960,Portobello Baked Eggs,"<p> Turn the oven to broil. Clean mushroom caps and, if desired, lightly scrape the gills out of the underneath of each cap. Brush mushrooms on both sides with olive oil , and season with salt and pepper. Place gill side down on a sheet pan and cook for about 3-5 minutes. Remove from the oven.</p><p> <br> Turn the oven down to 350°F. <br> <br> Turn the mushrooms gill side up and start building.  First, place the spinach into the cap building up the sides and creating a well in the middle, if necessary, to accommodate the egg. Add some goat cheese and Carefully break one egg into the well of each of the mushroom caps.</p><p> Now place them back into your 350°F oven and bake for 15 to 17 minutes depending on how well done or sunny-side-up you like your eggs. Serve immediately.</p>",4,20,https://img.spoonacular.com/recipes/157960-556x370.jpg,2026-03-14 22:23:37.08327+00,2026-03-14 22:23:37.144+00
157961,Kale Rolls,"<p> Bring a pan of lightly salted water to a boil. Dip each kale leave into the water for a few seconds until it become tender enough to roll. It will turn a nice bright shade of green which I used as my indicator. Quickly remove from the water and drain.</p><p> Saute onion and garlic in a large skillet until the onions are opaque, about 3 - 5 minutes. allow to cool until it is able to be handled. Then add meat, salt and pepper to taste, and rice and mix until combined being careful not to overwork the meat blend so it doesn't get too dense and will stay tender during cooking.</p><p> Preheat the oven to 350°F.</p><p> Next, add a bit of sauce, just enough to cover the bottom of a 9"" x 13"" baking pan as you will need the rest to cover the rolls when you are finished.</p><p> Now take 1 leaf, bottom (vein) side up, and place about 1/4 cup of meat into the bottom 3/4 of the leaf and roll it up tucking in the sides to secure the meat similar to rolling a burrito.  If the leaves are too small to tuck in the edges, as was the case with mine, no bother, I left them open and it turned out equally as fine with half the work.</p><p> Repeat until all the meat and leaves have been used. If you have extras of either, I tuck the meat in between the rows and/or layer the extra leaves on top of the other cabbage rolls and then top with the tomato sauce and petite diced tomatoes.</p><p> Cover the dish with aluminum foil and bake for about 90 minutes or until a thermometer stuck into the center of the largest roll reaches 160°F.</p>",8,90,https://img.spoonacular.com/recipes/157961-556x370.jpg,2026-03-14 22:24:13.409369+00,2026-03-14 22:24:13.504+00
157963,Meatball Vegetable Soup,"<p>In a small sauce pan spray with non-stick cooking spray, add onions and cook until softened.  Add juice, vegetables, onions, kale and stock to slow cooker for 4-6 hours, add meatballs and cooked pasta, salt and pepper, cook additional 15-20 minutes.</p><p>mix all ingredients, roll into small balls and bake for 20-30 minutes or until golden</p>",6,30,https://img.spoonacular.com/recipes/157963-556x370.jpg,2026-03-14 23:07:01.656811+00,2026-03-14 23:07:01.799+00
264382,Beginner's Quinoa Cakes,"<p>I made these the very first time I made quinoa. They reminded us of potato pancakes.</p><p>1. Cook the quinoa according to package instructions.</p><p>2. Mix the cooked quinoa with the eggs, Parmesan cheese, herbs, spices, salt, and pepper. Form patties.</p><p>3. Heat olive oil in a large skillet until hot.</p><p>4. Carefully place the patties in the hot oil. Do not attempt to flip them until they seem pretty browned on the bottom or they might fall apart.</p><p>5. Cook until both sides are nicely browned.</p><p>6. Serve with tomato sauce, fresh herbs, or whatever you like. This recipe serves 2 as a main dish or about 4 as a side dish (make the patties a bit smaller so you get 8 instead of 6).</p>",2,60,https://img.spoonacular.com/recipes/264382-556x370.jpg,2026-03-14 23:18:30.964175+00,2026-03-14 23:18:31.104+00
470064,Beefy Coconutty Curry,"<p>1. Mix the ground beef with 1 inch of chopped ginger and 1 clove of chopped garlic. Season with half of the curry powder, garam masala, and chili powder. Add salt and pepper.</p><p>2. Start preparing the basmati rice according to package instructions.</p><p>3. Steam the frozen broccoli and peas.</p><p>4. Heat a tablespoon of coconut oil in a skillet. Form small patties from the ground beef and add to the medium-hot skillet.</p><p>5. Once the patties are cooked through, transfer to a plate and keep warm.</p><p>6. If you buy coconut milk without any stabilizers/emulsifiers your coconut milk will separate so that the coconut cream can be scooped out leaving the water behind. This is important so you can create a thick sauce in the pan by only adding the coconut cream and a little of the water bit by bit until the desired consistency is reached. Add soy sauce and the rest of the ginger, garlic, and spices.</p><p>7. Return the patties to the pan and coat with sauce.</p><p>8. Serve with fresh cilantro and the Basmati rice with the vegetables mixed in.</p>",2,30,https://xeucxcfsrxiytajlaskq.supabase.co/storage/v1/object/public/recipe-images/470064.jpg,2026-03-14 22:24:51.881723+00,2026-03-14 22:24:51.984+00
511697,Morning Banana Split,"Cut banana lengthwise in half.Top with yogurt, berries and granola.",1,45,https://xeucxcfsrxiytajlaskq.supabase.co/storage/v1/object/public/recipe-images/511697.jpg,2026-03-14 23:18:25.874928+00,2026-03-14 23:18:26.005+00
511728,Pasta Margherita,"Whisk oil, garlic, basil, salt together in large bowl. Add tomatoes and mozzarella then gently toss to combine; set aside.Cook pasta according to package directions for al dente. Drain well.Add pasta to tomato mixture and gently toss to combine.Serve immediately.",4,45,https://xeucxcfsrxiytajlaskq.supabase.co/storage/v1/object/public/recipe-images/511728.jpg,2026-03-14 23:22:18.57186+00,2026-03-14 23:22:18.717+00
511748,Breakfast Tacos,"Cook potato in microwave. Slice and cut into thin strips.In a small saut pan heat butter over medium heat. Add potato to pan and lightly brown potato, season with salt and pepper.Add eggs to potato. Stir to scramble and combine.Wrap tortillas in a damp paper towel. Heat in microwave for about 45 seconds.Place equal amounts in each tortilla and top with shredded cheese.",2,45,https://xeucxcfsrxiytajlaskq.supabase.co/storage/v1/object/public/recipe-images/511748.jpg,2026-03-14 22:24:20.954535+00,2026-03-14 22:24:21.052+00
622825,Tortilla Burger Loco Vaca,"<ol><li>Put the tortillas in the oven at about 80°C just to get them warm.</li><li>Fry the strips of bacon until crispy, then put the bacon in the oven to keep it warm.</li><li>Spice the ground beef with salt, pepper, and cumin.</li><li>Form 2 large patties and start frying the patties in a well heated pan.</li><li>Slice the avocado and the red onion.</li><li>Get the tortillas out of the oven and prepare them with the onion, avocado, bacon, cheddar, cilantro, and the patties.</li><li>Wrap it all up and then wrap your teeth around it.</li></ol>",2,40,https://xeucxcfsrxiytajlaskq.supabase.co/storage/v1/object/public/recipe-images/622825.jpg,2026-03-14 22:23:24.178217+00,2026-03-14 22:23:24.277+00
631757,Savory Slow Roasted Tomatoes with Filet of Anchovy,"Preheat oven to 150 C or 280 F
Cut the top 3rd off the tomatoes & discard top.
Place tomatoes on a baking tray, lined with parchment paper. Sprinkle generously with salt, pepper & herbs. Drizzle with a generous amount of olive oil.  Place in the oven for 4-6 hours depending on the size of your tomatoes. Every once in a while as you pass the kitchen, baste the tomatoes in the juices & olive oil in the pan.
Once the tomatoes shrivel up a bit & start to look sun-dried, they are ready. They should still hold their shape & not become mush.
Remove from oven, top each tomato with a whole anchovy filet. Serve warm or room temperature with olive oil from the baking pan drizzled over the top.",4,45,https://xeucxcfsrxiytajlaskq.supabase.co/storage/v1/object/public/recipe-images/631757.jpg,2026-03-14 22:23:31.430689+00,2026-03-14 22:23:31.532+00
631807,"Toasted"" Agnolotti (or Ravioli)","Preheat oven to 180 degrees Celsius (350 F) for a fan-forced oven or 200 degrees Celsius (392 F) for a convection oven.
Line a baking tray with baking paper.
Spray a thin layer of olive oil (any oil of your choice will do) on the baking paper. Set aside.
Crack and beat an egg on a plate. On a separate plate  add breadcrumbs.
Dip agnolotti in the beaten egg first.
Then coat it with breadcrumbs.  Repeat step 5 and 6 with the remaining agnolotti until egg and breadcrumbs are finished.
Place the crumbed agnolotti onto a baking tray. Once youve completed step 5 and 6, spray another thin layer of oil over the crumbed aganolotti. Bake the crumbed agnolotti for 25 minutes or until golden brown.
Serve immediately with pasta sauce or ketchup.",2,45,https://xeucxcfsrxiytajlaskq.supabase.co/storage/v1/object/public/recipe-images/631807.jpg,2026-03-14 22:24:16.414134+00,2026-03-14 22:24:16.507+00
631814,"$50,000 Burger","<ol><li>Prepare a medium-hot fire in a charcoal grill with a cover, or preheat a gas grill to medium-high.</li><li>For the patties:</li><li>Combine the chuck, basil, sun-dried tomatoes, onion, garlic, and salt in a large bowl, handling as little as possible. Shape into 2 patties to fit the bun size. Loosely cover with plastic wrap and set aside.</li><li>For the fennel:</li><li>Grate 1/2 teaspoons zest from the lemons. Put the fennel rings in a medium-sized bowl (I used half a fennel bulb) and juice the lemon over half the fennel and toss to coat all the fennel rings. Add oil and season with salt. Put the fennel in a grill basket and grill, shaking the basket occasionally, until soft, 10 to 12 minutes. (I did this on the stove top) Transfer the fennel to a sheet of foil, sprinkle with the lemon zest, and wrap to keep warm.</li><li>Heat a large, heavy nonstick fire-proof skillet on the grill. Add the bacon and cook until crisp. Transfer to paper towels to drain. Wrap in foil to keep warm.</li><li>For the topping:</li><li>Drain off the bacon fat from the skillet, wipe out the skillet with paper towels, and set the skillet back on the grill. Add the walnuts to the skillet and toast until golden and fragrant; set aside.</li><li>Whisk the vinegar with the oil in a small bowl and season with salt, to taste. Combine the figs, arugula, and toasted walnuts in a medium bowl. Toss with just enough dressing to coat. (I like a tart vinaigrette so I use a 1:1 ratio for the oil and vinegar)</li><li>When the grill is ready, brush the grill rack with vegetable oil. Place the patties on the rack, cover, and cook, turning once, until done to preference, 5 to 7 minutes on each side for medium. Place the cheese slices on the patties during the last 3 minutes of grilling. Place the buns, cut side down, on the outer edges of the rack to toast lightly during the last 2 minutes of grilling.</li><li>To assemble the burgers, place equal portions of the warm grilled fennel on each bun bottom, followed by a cheese-topped patty, 2 bacon slices, and an equal portion of the fig-arugula topping. (I would use a lot of the fig topping) Add the bun tops and serve.</li></ol>",4,45,https://xeucxcfsrxiytajlaskq.supabase.co/storage/v1/object/public/recipe-images/631814.jpg,2026-03-14 23:20:21.930903+00,2026-03-14 23:20:22.064+00
631834,10-Minute Bean Stew,"Add the canned tomatoes, kidney beans, tomato puree and thyme to a large saucepan. Cut 5 cherry tomatoes into quarters and crush 2 garlic gloves - add them to the pan.
Add the juice of half a lemon along with salt and pepper to taste.
Turn on the heat. Bring the stew to a boil before turning down the heat to allow it to simmer for 8-10 minutes. Season with salt and pepper before serving.",2,45,https://xeucxcfsrxiytajlaskq.supabase.co/storage/v1/object/public/recipe-images/631834.jpg,2026-03-14 23:05:38.040966+00,2026-03-14 23:05:38.195+00
632017,Agedashi Tofu,"<ol><li>Cut tofu into 12 cubes. Place cornstarch on a plate or in a shallow bowl and dredge tofu in it, coating thoroughly.</li><li>Heat enough oil so that tofu will be half-way submerged. Fry tofu in hot oil for 3 to 5 minutes on each side, or until crispy. Drain on paper towels.</li><li>Sprinkle green onions over tofu and drizzle with hoisin sauce. Serve immediately.</li></ol>",1,45,https://xeucxcfsrxiytajlaskq.supabase.co/storage/v1/object/public/recipe-images/632017.jpg,2026-03-14 22:23:47.294094+00,2026-03-14 22:23:47.392+00
632046,Alaskan Smoked Salmon Nicoise Salad With Alouette Crumbled Feta,"<ol><li>Prepare the dressing with the olive oil, chopped basil, garlic, salt, pepper and vinegar, Refrigerate.</li><li>Quarter the tomatoes.  Thinly slice the eggs.  Halve the cucumber and cut it into thin slices.  Slice the onion into thing rings</li><li>Instead of mixing the ingredients together, which you can do, I like to arrange them on a salad place for clor and appearance.  Sprinkle the cheese on top, drizzle with the dressing and serve.</li></ol>",12,45,https://xeucxcfsrxiytajlaskq.supabase.co/storage/v1/object/public/recipe-images/632046.jpg,2026-03-14 23:11:42.352365+00,2026-03-14 23:11:42.505+00
632050,Albondigas (Meatball Soup),"<ol><li>Preheat oven to 350 degrees.</li><li>Combine beef, onion,  cup celery, garlic, cumin, eggs, rice, parsley, oregano, and bread crumbs, and salt and pepper.</li><li>Mix well. Form into 30 small meatballs.</li><li>Bake on baking sheet at 350 degrees for 20 minutes, set aside.</li><li>Place the potatoes in boiling water and cook until tender, but not too soft. Drain and set aside.</li><li>Heat olive oil in a large stock pot.</li><li>Add carrots,  cup celery, and garlic.</li><li>Saut for about 5 minutes.</li><li>Add the tomatoes, chili flakes, and the potatoes.</li><li>Add the chicken stock and season to taste with salt and pepper.</li><li>Bring to boil, reduce heat and simmer for 30 minutes.</li><li>Add meatballs and simmer on low heat until ready to serve.</li><li>Serve hot and garnish with cilantro and lime and corn tortillas.</li></ol>",1,45,https://xeucxcfsrxiytajlaskq.supabase.co/storage/v1/object/public/recipe-images/632050.jpg,2026-03-14 22:24:28.247884+00,2026-03-14 22:24:28.35+00
632297,Amatriciana,"<ol><li>In a pot heat the olive oil, add the clove of garlic & onions on low heat season with salt & chili flakes as you like. Saute slowly without color for 10 minutes. As you stir try to mash up the onions.</li><li>Add guanciale or pancetta cook for an additional 5 - 6 minutes.</li><li>Remove garlic clove & add tomatoes. Bring to a simmer for 10 minutes. Add a little pasta water if it gets too thick.</li><li>Toss with fresh cooked pasta (bucatini is best) & Parmesan cheese.</li></ol>",4,45,https://xeucxcfsrxiytajlaskq.supabase.co/storage/v1/object/public/recipe-images/632297.jpg,2026-03-14 22:24:33.729804+00,2026-03-14 22:24:33.822+00
632342,An American Beef Burger,"Place the meat, egg, garlic shallot, salt and pepper in a bowl and mix through with your hands. Do this until everything is as even as possible - you wouldn't want to get a mouthful of onion or garlic!  Divide the burger mix into 4 equal parts.  Form each burger by rolling it into a ball in your hands and flatten a little, but keep them nice and thick.
Heat the oil in a heavy bottomed pan, when hot, place the burgers in the pan. The heat should be medium/hot.
The cooking time will depend on how thick you make your burger and how you like them cooked. I find that my burgers take about 4 to 6 minutes on each side for a burger that is about 3cm thick (just over an inch) for a medium result.
When the burgers are cooked, lift them out of the pan and set aside. Take your burger buns and place them face down in the pan, toast them in the burger flavour for a minute or two on each side.
To serve, place the little gem leaves on your bread, then the tomato, the burgers on top, lay over a couple of slices of pickle and some sliced raw onion on top.",4,45,https://xeucxcfsrxiytajlaskq.supabase.co/storage/v1/object/public/recipe-images/632342.jpg,2026-03-14 23:18:10.841439+00,2026-03-14 23:18:10.975+00
632353,Andouille Sausage and Potato Hash,"Preheat the oven to 425. Toss the potato, peppers, and onions with 1 teaspoon canola oil.
Spread onto a baking sheet. Sprinkle with garlic salt and pepper. Roast for 10 minutes.
Add the sliced sausage to the pan and roast for an additional 10 minutes.
Sprinkle with a dash of cayenne pepper.
Garnish with finely chopped scallions if desired. Enjoy!",1,45,https://xeucxcfsrxiytajlaskq.supabase.co/storage/v1/object/public/recipe-images/632353.jpg,2026-03-14 22:23:11.930165+00,2026-03-14 22:23:12.021+00
632741,Arroz De Galinha (Reinvented),"Slice the chicken breasts into strips and place in a bowl. Wash hands and cutting surface thoroughly.
Crush and mince the garlic cloves in another bowl. Add in a pinch or so of each herb/spice and the vinegar and mix well with a fork. Put the marinade in the bowl with the chicken and stir to coat the chicken.
Wrap with plastic wrap and place in the fridge until ready to use.
In a large skillet over medium high heat, add in the olive oil. Next, add onion and red bell pepper, sauteing until the onion is translucent, about a minute or so.
Add in the chicken and cook until browned on the outside. Reduce heat to medium.
Toss in the pepper flakes, salt & pepper, zest of the lemon, half the cilantro and stir. Remove the chicken/onion/pepper mixture from the pan and place in a bowl, cover with foil and set aside.
Slice the chorio at an angle and place in the hot skillet and allow to cook until it gets crispy bits around the edges. Remove from pan and add to the chicken bowl.
Pour the wine into the pan to de-glaze it, lightly scraping the yummy bits off the bottom of the pan as it cooks. Add in the tomato sauce and bring to a simmer and allow to cook 5 minutes or so.
Toss the chicken/chorio/veggie mix back into the pan along with the juice of the lemon. Stir well and again allow to simmer for about 5 minutes or until youre certain the chicken is cooked through. Remove from heat.
Spoon the chicken mixture into the rice bowls and top with cilantro.",6,45,https://xeucxcfsrxiytajlaskq.supabase.co/storage/v1/object/public/recipe-images/632741.jpg,2026-03-14 23:13:21.567286+00,2026-03-14 23:13:21.693+00
