spoonacular_recipe_id,title,instructions,servings,ready_in_minutes,image_url,created_at,updated_at
660133,Simple Roast Chicken,"Wash the chicken inside and out and pat dry. Make sure the skin is nice and dry so the skin gets crispy. Season well with salt and pepper inside, out and under the skin.
Mix the butter with the garlic, chilli and lemon rind. Season a bit with salt and pepper. Stuff the flavoured butter under the skin over the breast, legs and back. Stuff the lemon half into the cavity.
Pre-heat the oven to 400F. Toss the two kinds of potatoes in the bottom the the baking pan with the chilli, salt and pepper to taste and a generous helping of olive oil. Place a rack over the vegetables. Position the chicken breast side up on the rack.
Bake for the first 15 minutes at 400F. Then drop the temperature and continue to cook for about an hour at 300F.
Halfway through cooking turn the chicken on its breast. Spoon over some of the juices.
Later, to check for doneness, pierce the thickest part of the chicken (the thigh). If the juices run clear the chicken is ready, if not continue cooking.
Serve chicken on a platter on the bed of roasted potatoes.",4,45,https://xeucxcfsrxiytajlaskq.supabase.co/storage/v1/object/public/recipe-images/660133.jpg,2026-03-14 22:22:50.638646+00,2026-03-14 22:22:50.74+00
660283,SLOW COOKER CHICKEN GUMBO SOUP,Put all ingredients in crockpot and cook on high for 4 hours or low for 6 to 7 hours.,6,45,https://xeucxcfsrxiytajlaskq.supabase.co/storage/v1/object/public/recipe-images/660283.jpg,2026-03-14 22:22:34.471243+00,2026-03-14 22:22:34.563+00
660286,Slow Cooker Chicken Verde Enchilada,"<ol><li>Layer the chicken in the slow cooker. Make sure it is completely defrosted before cooking. Sprinkle all of the spices over the chicken. Place the jalapenos, tomatillos, onion and garlic on top of the chicken, making sure to let them sit on top so you can easily pull out later. Pour water into the slow cooker. Put lid on turn to low and cook for 2 hours. Turn to high and cook for 2 more hours until chicken is cooked all the way through.</li><li>Pull all the vegetables out of the slow cooker and place in blender. Puree the mixture till smooth. Remove chicken place on a cutting board and shred chicken, discarding skin and bones.</li><li>Place the chicken back in the slow cooker. Pour the sauce over the chicken and mix until evenly distributed.</li><li>Preheat oven to 400 degrees Fahrenheit. Make enchiladas, place about  cup of chicken mixture in tortilla. Sprinkle 1 TBSP of Cheddar Cheese on top of chicken. Roll tortilla and place it seam side down in a large glass baking dish. Repeat till all chicken mixture is gone, which makes about 18 enchiladas. You will need to use between 2-3 glass baking dishes, depending on the size.</li><li>Make the sauce. Add avocado, yogurt, lime juice, pepper and garlic powder to blender. Puree until smooth. Use a spatula to evenly distribute sauce over all dishes of enchiladas. Divide and sprinkle the Mexican cheese over all the enchiladas.</li><li>Cover in foil and bake until cheese is melting and bubbly, about 20 minutes.</li></ol>",8,45,https://img.spoonacular.com/recipes/660286-556x370.,2026-03-14 22:23:18.80287+00,2026-03-14 22:23:18.9+00
660313,Slow-Roasted Tomatoes,"<ol><li>Prepare the tomatoes. Adjust oven rack to lower-middle position and heat oven to 325 degrees f. Add 2 T. oil to a 13 x 9-inch nonreactive baking pan (such as glass or ceramic). Sprinkle half the garlic and half the basil over the bottom of the pan. Add the tomatoes to the pan and season lightly with salt. Sprinkle with the remaining garlic and basil. Drizzle with the remaining olive oil. Bake for 1 1/2 hours.</li><li>For the breadcrumbs: While the tomatoes are baking, place the bread in a food processor and pulse to make breadcrumbs. Heat 1 T. olive oil in a small skillet over medium heat. Add the breadcrumbs and saute, stirring fairly constantly until browned and crisp, about 10 minutes. Set aside to cool completely. When cool add Parmesan, basil and parsley. Serve the breadcrumbs sprinkled on the tomatoes.</li></ol>",4,45,https://xeucxcfsrxiytajlaskq.supabase.co/storage/v1/object/public/recipe-images/660313.jpg,2026-03-14 23:21:36.842378+00,2026-03-14 23:21:36.99+00
660370,Smoked Salmon Fettuccine,"Cook noodles according to package directions, drain and place in cold water bath.  Keep a pan of hot water ready to reheat noodles.
In a 12 skillet, melt butter and lightly saut garlic for a minute  do not brown.  Pour in cream and bring to a light boil, then lower heat and simmer rapidly to reduce the sauce by half, or until thick and creamy.  Stir in asparagus and pine nuts, then add chunked up salmon (bite sized pieces) and lightly stir around and add reheated/drained noodles.  Serve immediately on warmed plates.  Top each serving with fresh grated Parmesan Reggiano and fresh lemon juice to taste.",4,45,https://xeucxcfsrxiytajlaskq.supabase.co/storage/v1/object/public/recipe-images/660370.jpg,2026-03-14 22:23:46.547556+00,2026-03-14 22:23:46.65+00
661121,Spicy Lemongrass Soup,"Chop the lemongrass into 2 inch pieces and then slice down the center, add to the soup pot along with the broth and coconut milk, garlic and ginger.  Bring to a boil and them simmer on low for 30 minutes.  Once the broth is done simmering you will want to strain it through some cheese cloth.  The lemongrass stalks are not edible, I found that out the hard way.
Bring the broth back to a simmer and add the tofu, mushrooms, snow peas and the rice noodles.
You can add the lime juice at any time.
I added some lime juice at the beginning and then some at the end before serving.
Simmer until the noodles are soft.
Garnish with grated ginger or scallions.",4,45,https://xeucxcfsrxiytajlaskq.supabase.co/storage/v1/object/public/recipe-images/661121.jpg,2026-03-14 22:22:55.638608+00,2026-03-14 22:22:55.74+00
661122,"Spicy lentil and black rice soup with kale, spinach and leek","<ol><li>Start by soaking your beautiful green lentils in water while you dice up all of your veggies.</li><li>While your lentils are soaking in the water, chop up your  carrots, celery, garlic, onion and leek.</li><li>Once all your veggies are chopped, heat up the olive oil in a stock pot over medium high heat and add the diced veggies.  Cook just until the the onion and garlic softens, about 7 minutes or so.</li><li>While your veggies are cooking, chop up your kale and get it ready to go, but don't add it yet.  You don't need to worry about chopping the spinach leaves, when it comes time to add them, just use the whole leaf.</li><li>Once your veggies are cooked, drain your lentils and add them and the rice to the veggies. If you can't find a black rice, just use wild rice.</li><li>Give the veggies, rice and lentils a stir and then add your veggie broth, water, kale, spinach and all of the spices and turn the heat to high.</li><li>Keep the burner on high just until the soup boils, reduce the heat to low and cover for 25 minutes. Covering the soup will ensure that the lentils and rice cook thoroughly.</li><li>After the soup cooks covered for 25 minutes, remove the cover and continue to cook on low for another 30 minutes or so.  I added another 1/2 tsp of salt and a bit of pepper for flavoring at this point and it was a perfect balance.</li><li>After the final 30 minutes of simmer, simply serve and enjoy!</li></ol>",12,45,https://xeucxcfsrxiytajlaskq.supabase.co/storage/v1/object/public/recipe-images/661122.jpg,2026-03-14 22:22:41.763479+00,2026-03-14 22:22:41.863+00
661223,Spicy Vegan Chili,"<ol><li>Heat the olive oil in a pot over medium-high heat. Once the pan is hot, add the onions. When the onions start to turn translucent, add the diced potatoes. Let it cook for a minute or two, and add the diced tomatoes, jalapeo, garlic, chili powder, cumin, and cayenne pepper.</li><li>Cook everything for about another minute and add the vegetable broth. Bring the broth to a boil.</li><li>While the chili is cooking, remove the rough stem from the collard green leaves. Chop them into strips.</li><li>Once the chili has boiled, add the beans and chopped collards. Chop the tofu in half, and crumble each half with your hands. I did this right over the boiling pot. Be careful of hot liquids splashing out!</li><li>Season with the salt and boil for another 5-10 minutes, or until the potatoes can be easily pierced with a fork.</li><li>Turn off the heat and serve the chili with some ground pepper.</li><li>Store any leftovers in an airtight container.</li></ol>",5,45,https://xeucxcfsrxiytajlaskq.supabase.co/storage/v1/object/public/recipe-images/661223.jpg,2026-03-14 22:24:43.0025+00,2026-03-14 22:24:43.104+00
661287,Spinach Chickpea - Palak Chana Rice,"<ol><li>Method</li><li>Grind clean spinach and green chilies into smooth paste and set it aside</li><li>In a deep heavy bottom pot, warm 2 tbsp of oil, add cinnamon, cloves and cardamom. Wait for 30 to 45 seconds then add sliced onions. Fry onions till they are transparent or light brown. Now add in spinach chili paste. Fry till the oil separates out, add cooked chickpeas, mix well  Add grated coconut, fry for 30 seconds. Next add in soaked rice and fry for another 2 minutes, then mix salt. Pour in water and cook till the rice is cooked. Serve with curd or rita. I garnished the food with carrot curls and flower, check this video if you want to learn  carrot curls  and  carrot flowers</li></ol>",2,45,https://xeucxcfsrxiytajlaskq.supabase.co/storage/v1/object/public/recipe-images/661287.jpg,2026-03-14 22:24:18.807253+00,2026-03-14 22:24:18.911+00
661302,Spinach Kugel,Mix the above ingredients together and pour into a 3 quart greased mold. Bake in a preheated 350 degree oven for 1 hour.,10,45,https://img.spoonacular.com/recipes/661302-556x370.,2026-03-14 22:24:32.258968+00,2026-03-14 22:24:32.358+00
661427,"Spring Risotto with Shrimp, Asparagus and Artichoke Hearts","In a small saucepan, bring chicken/vegetable broth to a boil. Once boiled, reduce heat to low and keep hot.
In a separate large saucepan, melt butter over medium heat then add garlic and shallot and saute for 2-3 minutes, until softened. Add rice and stir, then add in the wine and stir until nearly absorbed by the rice.
Add  cup of the hot broth, stirring until absorbed. Keep adding the broth,  cup at a time, and stirring constantly until it is nearly absorbed before adding more. This took a couple of minutes for each cup of broth to absorb.
After about 10-15 minutes, depending on how long the broth takes to absorb, the rice start becoming tender. When there is about 1 cup of hot broth left, toss in the asparagus, peas and artichoke hearts and continue to stir.
When there is about  cup of hot broth left, add shrimp, continue stirring constantly until all the hot broth has been added. Taste rice for tenderness and to determine if any additional hot broth needs to be added. The rice should be tender and the liquid should be creamy.
Top with freshly grated lemon zest, stir in grated parmesan and season with salt and pepper and serve hot!",4,45,https://xeucxcfsrxiytajlaskq.supabase.co/storage/v1/object/public/recipe-images/661427.jpg,2026-03-14 22:22:36.111306+00,2026-03-14 22:22:36.209+00
661556,Steamed Chicken With Soy-Ginger Sauce,"<ol><li>Arrange the chicken halves skin side up and side by side in a glass pie plate.  Rub the skin with the soy sauce.  Let stand for 15 minutes.</li><li>Prepare a steamer and heat over high heat.  Place the pie plate in the steaming basket, cover, and steam over high heat until the chicken is no longer pink near the bone, about 30 minutes.</li><li>Meanwhile, make the sauce:  stir the grated ginger, green onions, sesame oil, soy sauce, garlic, ground ginger, salt, and pepper in a small heatproof bowl.  Heat the vegetable oil in a small skillet just until it begins to smoke.  Carefully pour the hot oil into the ginger-soy mixture (the mixture may sizzle).  Stir well and let stand until cool.</li><li>Remove the plate of chicken from the steamer and let cool slightly.</li><li>Strip the meat from the bones and cut the meat into bite-sized pieces.  Place on a serving platter with the lettuce cups alongside.</li></ol>",4,45,https://xeucxcfsrxiytajlaskq.supabase.co/storage/v1/object/public/recipe-images/661556.jpg,2026-03-14 22:24:39.036386+00,2026-03-14 22:24:39.136+00
661741,Strawberry and Chocolate Chip Panini,"Open up the slices of sourdough bread
Brush it wit some olive oil on either side
Add a layer of strawberries and chocolate chips
Put it in the panini press!
Serve it hot with a side of fresh cut berries!",1,45,https://xeucxcfsrxiytajlaskq.supabase.co/storage/v1/object/public/recipe-images/661741.jpg,2026-03-14 22:24:08.423958+00,2026-03-14 22:24:08.528+00
661751,Strawberry And Vanilla Cream Bread Pudding with Toasted Coconut,"Preheat Oven to 350 degrees
Whisk together vanilla pudding, eggs, lemon zest, and strawberries.
Place bread pieces in a single layer on an un-greased, unlined, cookie sheet, and toast for 10 minutes or until crispy.
Fold bread pieces into the pudding mixture and pour into a 5""x8"" pan.
Bake for 1 hour 15 minutes.
Garnish with toasted coconut.",5,45,https://xeucxcfsrxiytajlaskq.supabase.co/storage/v1/object/public/recipe-images/661751.jpg,2026-03-14 23:22:06.342555+00,2026-03-14 23:22:06.487+00
662208,Summer Berry Pudding,"Reserve a few berries to decorate the finished pudding.
Hull and slice the strawberries. Place in a frypan with the other berries and cherries, sprinkle with castor sugar and add the water or pomegranate juice.
Simmer for about three minutes to release the juices, stirring gently once or twice.
Place a sieve over a bowl and tip the fruit in. Allow to drain for 10 minutes, keeping the juice.
Meanwhile line a 1.5 litre capacity bowl with plastic wrap.
Cut a circle out of the bread to fit the bottom of the bowl. Cut slightly tapered shapes to line the bowl and triangles for the top.
Dip one side of the bottom circle of bread quickly into the juice and place, juice side down, into the bowl.
Do the same with the bread for the sides, dipping them in the juice then overlapping them by a couple of centimetres.
Spoon in the fruit.
Arrange the triangles of bread on top, again overlapping the pieces.
Gently pour over the remaining juices.
Cover the top with more plastic wrap and then place the bowl in a shallow dish to catch any juices.
Choose a flat plate that fits the top of the bowl. Place it on top and weigh down with something heavy. Refrigerate for a few hours or overnight.
To serve, collect any juices. Remove the plastic from the top and turn the pudding out onto a serving plate. Pour over any remaining juice.
Decorate with the reserved fruit and serve with sweetened whipped cream.",8,45,https://xeucxcfsrxiytajlaskq.supabase.co/storage/v1/object/public/recipe-images/662208.jpg,2026-03-14 23:18:55.756868+00,2026-03-14 23:18:55.894+00
662243,Summer Rolls,"<ol><li>Place all marinade ingredients in a zip lock bag.</li><li>Seal bag and shake to coat the tofu.</li><li>Place in the fridge for at least half an hour or up to one day.</li><li>When ready to assemble rolls, place a piece of rice paper in a shallow pan of water.</li><li>Leave in water, turning once, until the sheet is flexible.</li><li>Place on a flat moist surface and arrange piece of avocado and a piece of tofu near the edge of the rice paper that is closest to you.</li><li>Add 2-4 pieces of cucumber, pineapple, and red bell pepper each.  Top with a small amount of vermicelli and a few sprigs of cilantro.</li><li>Take the edge of the rice paper and holding the filling tightly begin to roll as if rolling a burrito.  Make sure to fold the sides inward as you go.</li><li>Place finished roll on platter to dry.</li><li>Repeat steps until you run out of ingredients.</li><li>Serve with thai chili sauce or spicy peanut sauce.</li></ol>",6,45,https://xeucxcfsrxiytajlaskq.supabase.co/storage/v1/object/public/recipe-images/662243.jpg,2026-03-14 22:23:00.08469+00,2026-03-14 22:23:00.185+00
662276,Sun Dried Tomato and Herb Baked Eggs,<ol><li>Preheat oven to 350 F.</li><li>Cover the inside of one ramekin or oven safe dish with olive oil.</li><li>Line the bottom of the dish with sundried tomatoes and break two eggs on top. Sprinkle with fresh herbs.</li><li>Bake uncovered for 15-20 minutes until egg whites are firm.</li><li>Serve immediately.</li></ol>,1,25,https://xeucxcfsrxiytajlaskq.supabase.co/storage/v1/object/public/recipe-images/662276.jpg,2026-03-14 23:18:35.158027+00,2026-03-14 23:18:35.297+00
662291,Sun-Dried Tomato and Leek Quiche,"Crust
Preheat oven to 350F.
Coat four 5-inch tart pans with cooking spray.
Pulse flour, pine nuts,almonds,baking powder
In food processor until finely ground.
Whisk together almond milk, oil and salt in bowl.
Stir in flour mixture. Press into pan.
Bake 5 minutes, then cool.
Filling
Heat 1 Tbs. oil in skillet over medium heat.
Add leeks, and saute' 8 minutes, or until softened. Set aside.
Bring large saucepan of water to a boil.
Add tofu, and simmer 5 minutes.
Drain and pat dry.
Whisk 3 Tbsp. oil, lemon juice, miso, garlic and salt in bowl.
Add tofu and blend with an immersion blender.
Stir in breadcrumbs,seasonings, sun-dried tomatoes and leeks.
Spoon filling into crust.
Bake 40 minutes, or until crust is browned.
Cool 5 minutes, then unmold.",4,45,https://xeucxcfsrxiytajlaskq.supabase.co/storage/v1/object/public/recipe-images/662291.jpg,2026-03-14 23:11:09.272455+00,2026-03-14 23:11:09.429+00
662649,"Sweet, Spicy Cherry Tomato Pasta","1.Heat the oil in a non-stick frying pan.
2.Set your spaghetti on to cook as per instructions on the packet.
3.Add the shallots, garlic, chili to the hot oil in the frying pan and cook for just under a minute, add the bacon and cook for about two minutes or until it is cooked through.
4.De-glaze with half of the lemon juice, stir through.
5.Add the tomatoes, tomato pure, honey and a little salt (not too much as the bacon might be salty) and some pepper. Cook on a medium heat, letting everything simmer gently.
6.Take about 4 to 6 tbsps of the water in which your pasta is cooking and add it to the sauce, stir through and cook until the tomatoes soften, this should take just over five minutes.
7.Check for seasoning, add the rest of the lemon juice, the parsley. Add the balsamic vinegar if you think the sauce needs it or adjust the flavour in any other way. At this stage if I want more spice, I tend to add a few flakes of dried chili.
8.Add the pasta when it is ready. I like to do this straight from the pan in which it is cooking by dragging it into the sauce with some tongs. This sauce can be a bit dry and can benefit from the extra moisture.
9.Dress with the parmesan, basil and olive oil before serving.",4,45,https://xeucxcfsrxiytajlaskq.supabase.co/storage/v1/object/public/recipe-images/662649.jpg,2026-03-14 23:10:40.907081+00,2026-03-14 23:10:41.064+00
662654,Sweet-N-Smoky Salmon With Ginger Mahogany Rice,"<ol><li>Place the salmon in bowl, or large zip bag with soy sauce, liquid smoke and brown sugar. Let it marinate for at least 1 hourbut you could marinate over night! When ready to use, preheat the grill or an iron skillet to high heat.</li><li>In a medium sauce pan, over high heat, toast the rice in 1 Tb. of oil for 2 minutes. Then add the chicken stock and a large pinch of salt and pepper. Bring to a boil. Lower the heat to a simmer and cover. Simmer the rice for about 40 minutesor as directed on the package.</li><li>Meanwhile, peel the ginger and cut into thin strips. (julienne)</li><li>Heat a small skillet over medium-high. Add 1 Tb. of oil to the skillet. When the oil is hot, drop the ginger in and pan-fry for 1-2 minutes, moving with a spatula, until they are light brown.</li><li>Remove from the pan and drain on a paper towel. Sprinkle with salt.</li><li>While the rice is cooking, CAREFULLY brush the grill with vegetable oil. (You could also use grill spray.) Pepper the salmon and place it on the grill, top-side-down. Cook 3 minutes.</li><li>Flip, then carefully sprinkle the tops with a little extra brown sugar and grill for another 3-5 minutesuntil just cooked through.</li><li>Cover with foil and let them rest for 5-10 minutes before serving.</li></ol>",4,45,https://xeucxcfsrxiytajlaskq.supabase.co/storage/v1/object/public/recipe-images/662654.jpg,2026-03-14 23:21:14.929252+00,2026-03-14 23:21:15.074+00
663149,Thai Sausage Salad,"In a small bowl, combine the dressing ingredients and stir until the sugar has dissolved. Taste and adjust with more sugar or fish sauce if needed (some limes are more tart than others). Set aside.
Slice the sausage thinly on the diagonal. Place in a non stick skillet over medium heat and saut until the edges are slightly browned and sausage is cooked thru, about 5 minutes. Dont over cook. Set aside to cool
Peel the cucumbers, slice thinly and place in a large bowl. Thinly slice the green onions on the diagonal and add to the bowl. Add the bean sprouts, cooked sausage and the dressing. Lightly toss and serve on plates with jasmine rice on the same plate. Garnish with a few slivers of sliced hot chili pepper, if desired, and a few leaves of fresh parsley or cilantro.
Serves 2 as a main course salad.",2,45,https://xeucxcfsrxiytajlaskq.supabase.co/storage/v1/object/public/recipe-images/663149.jpg,2026-03-14 23:13:33.797206+00,2026-03-14 23:13:33.919+00
663252,The Blarney Burger,"Irish Mustard Sauce: 1 tbsp cornstarch, 2 tsp sugar, 1 tsp dry mustard, 1/2 tsp salt, 1 cup water, 1 tbsp butter, 1/4 cup vinegar, 1 tsp horseradish, 2 egg yolks, beaten. Put all ingredients in a sauce pan over medium heat. Continue whisking until smooth and thickened to consistency of pudding.
Gorgonzola Butter-Wash: In a microwave safe bowl, add remaining tablespoon of Gorgonzola crumbles and 2 tablespoons of butter and melt.
Whisk together to create a Gorgonzola butter-wash.
Brush Gorgonzola butter-wash on the inside of the top & bottom buns and toast on the upper or outer edges of grill. Once rolls are lightly toasted, remove.
Meat: Mix first 7 ingredients together thoroughly then add salt & pepper. Form patties and pat together well.
Cook meat over medium heat - be sure to coat grill with non-stick spray.
Cook about 8-10 minutes on each side.
Set meat on bottom bun and spoon Irish mustard sauce on top of meat patty.
Add shredded cabbage and fold top and bottom together.",4,45,https://xeucxcfsrxiytajlaskq.supabase.co/storage/v1/object/public/recipe-images/663252.jpg,2026-03-14 22:23:41.955511+00,2026-03-14 22:23:42.039+00
663553,Tomato and Bacon Pizza With Rice Crust,"<ol><li>Preheat oven to 400F.</li><li>To make rice crust, mix ingredients in a bowl. Press onto greased pizza pan (10 inch) evenly.</li><li>Spread bacon, tomatoes, pepper and mozzarella cheese on top of rice crust.</li><li>Bake for 20 minutes or until cheese melts.</li><li>Slice and serve warm.</li></ol>",8,45,https://xeucxcfsrxiytajlaskq.supabase.co/storage/v1/object/public/recipe-images/663553.jpg,2026-03-14 22:24:12.911349+00,2026-03-14 22:24:12.991+00
663595,Tomato Free Mexican Lasagna,"Preheat oven to 350 degrees. Spray a non-stick skillet with non-stick cooking spray and heat on medium. Add beef, onion and mushrooms and cook until meat is cooked through. Drain if needed, I bought extra lean beef and there was no grease to drain today. Add garlic and cook another minute. Add beans, diced green chilies, corn, oregano, chili powder, garlic powder, cumin, pepper and kosher salt. Mix thoroughly.
Spray a 9 x 13 pan with non-stick cooking spray. Lay half of corn tortillas on bottom of pan. Add half of the beef mixture and 1/2 c of cheese. Layer remaining corn tortillas and top with beef mixture and 3/4 c cheese. Bake in oven uncovered for 15 minutes.
After cooking sprinkle with diced avocado and lettuce. Slice and serve and add a dollop of sour cream on top of slice.",10,45,https://xeucxcfsrxiytajlaskq.supabase.co/storage/v1/object/public/recipe-images/663595.jpg,2026-03-14 22:24:23.607887+00,2026-03-14 22:24:23.708+00
663771,Traditional Panzanella,"<ol><li>In a bowl combine the bread with water and let it stand for at least 20 minutes or until it's soft. Drain the bread and squeeze out as much water as you can.</li><li>Crumble the bread and place it in a serving bowl. Scatter the tomatoes, onions and chopped basil over the top.</li><li>Dress Panzanella with extra-virgin olive oil and vinegar. Season with salt and pepper and toss well.</li><li>Taste and adjust the seasoning with more oil, salt and vinegar.</li><li>Leave Panzanella to stand for 15 minutes and serve at room temperature.</li></ol>",6,45,https://xeucxcfsrxiytajlaskq.supabase.co/storage/v1/object/public/recipe-images/663771.jpg,2026-03-14 23:09:11.209307+00,2026-03-14 23:09:11.364+00
663813,Tricolor Rotini pasta Salad,"1)    Boil water in a large pan. Once water comes to boiling temperature immerse the pasta. Turn heat
to low and cook for another 10 minutes.  Keep it aside till it cools down.Or cook the pasta as per
the instruction given in the package.
2)    Chop the cucumber, olives and lettuce. Cut the plum tomatoes into half. Since I had no plum tomatoes
stored, I have used normal tomatoes
3)    Mix pepper powder and salt with the mayonnaise.
4)    Combine all the vegetables and mayonnaise dressing with the pasta and mix gently.",2,45,https://xeucxcfsrxiytajlaskq.supabase.co/storage/v1/object/public/recipe-images/663813.jpg,2026-03-14 23:14:44.700352+00,2026-03-14 23:14:44.845+00
